Título,Autor,Editora,Páginas,Formato,Peso,Acabamento,Categoria,Edição,Preço
O amor tem um nome,Adam Weber,Hagnos,288,16x23 Cm,380g,Brochura,,2021,"R$ 47,90"
Filhos da Promessa - Spurgeon,Charles H. Spurgeon,Hagnos,160,16x23 Cm,340g,Capa Dura,,2021,"R$ 39,90"
Contos ecológicos,Paulo Debs,United Press,48,18x24 Cm,200g,Brochura,,,"R$ 16,90"
"Nova Bíblia Viva – Estudo, leitura e compreensão - Preto",,Hagnos,1.552,16x23 Cm,940g,Capa PU + Douração Lateral,,2021,"R$ 177,89"
"Nova Bíblia Viva – Estudo, leitura e compreensão - Flores",,Hagnos,1.552,16x23 Cm,940g,Capa PU + Douração Lateral,,2021,"R$ 177,89"
"Nova Bíblia Viva – Estudo, leitura e compreensão - Marrom",,Hagnos,1.552,16x23 Cm,940g,Capa PU + Douração Lateral,,2021,"R$ 177,89"
"Nova Bíblia Viva – Estudo, leitura e compreensão - Moderna",,Hagnos,1.552,16x23 Cm,940g,Capa PU + Pintura Especial Lateral,,2021,"R$ 177,89"
Redescobrindo a beleza da vida,Lysa Terkeurst,United Press,272,16x23 Cm,400g,Capa Dura Com Borda Pintada,,2021,"R$ 54,90"
Homens mais parecidos com Jesus,David Merkh,Hagnos,288,16x23 Cm,380g,Brochura,,2021,"R$ 46,90"
Peregrinos da eternidade,A.W. Tozer,United Press,128,14x21 Cm,230g,Capa Dura,,2021,"R$ 33,90"
Comentário Biblico Swindoll - Tiago | 1 e 2 Pedro,Charles R. Swindoll,Hagnos,400,16x23 Cm,620g,Brochura,,2021,"R$ 71,90"
"Fé, o alimento da Alma - Spurgeon",Charles H. Spurgeon,Hagnos,272,16x23 Cm,400g,Capa Dura,,2021,"R$ 57,90"
Bíblia Pregação Expositiva | RA | PU luxo rosa - flores,Hernandes Dias Lopes,Hagnos,1.888,16x23 Cm,1120g,PU Luxo Rosa Com Borda Prateada,,2021,"R$ 277,91"
Bíblia Pregação Expositiva | RA | PU luxo azul escuro,Hernandes Dias Lopes,Hagnos,1.888,16x23 Cm,1120g,PU Luxo Azul Escuro Com Borda Prateada,,2021,"R$ 277,91"
Nova Bíblia Viva - Cross (Capa Dura),,Hagnos,1056,14x21cm,520g,Capa Dura Com Borda Pintada,,,"R$ 58,90"
Nova Bíblia Viva - Alegria (Capa Dura),,Hagnos,1056,14x21cm,520g,Capa Dura Com Borda Pintada,,,"R$ 58,90"
Mais que um rabino,Cesar Vidal,Hagnos,432,16X23 Cm,500g,Capa Dura,,2021,"R$ 74,90"
Bíblia de recursos para o ministério com crianças - APEC - Luxo PU Azul,APEC,Hagnos,1980,16x23cm,1300g,Luxo PU Azul Petróleo,,,"R$ 280,90"
João Batista - O mensageiro do Rei,Hernandes Dias Lopes,Hagnos,128,14 X 21cm,180g,Brochura,,2021,"R$ 44,90"
Gênesis - Comentários Expositivos,Hernandes Dias Lopes,Hagnos,752,14x21cm,660g,Brochura,,2021,"R$ 145,89"
101 ideias de como paparicar sua esposa e fortalecer seu lar,David Merkh,United Press,160,14x21cm,180g,Brochura,,2020,"R$ 30,90"
101 ideias de como paparicar seu marido e fortalecer seu lar,David Merkh,United Press,144,14x21cm,180g,Brochura,,2020,"R$ 30,90"
15 Lições para fortalecer sua família,David Merkh,Hagnos,224,16x23cm,320g,Brochura Com Borda Pintada,,,"R$ 40,90"
Nova Bíblia Viva - Leão Tribo Judá (Capa dura - Letra Grande) - Borda cinza,,Hagnos,1056,16x23 Cm,680g,Capa Dura Com Borda Colorida,,2020,"R$ 69,90"
Nova Bíblia Viva - Leão Tribo Judá (Capa dura - Letra Grande) - Borda Azul,,Hagnos,1056,16x23 Cm,680g,Capa Dura Com Borda Colorida,,2020,"R$ 69,90"
Nova Bíblia Viva - Leão Judá,,Hagnos,1056,14x21cm,480g,Capa Flexível,,,"R$ 45,90"
Nova Bíblia Viva - Rugido (Capa Dura),,Hagnos,1056,14x21cm,660g,Brochura Com Borda Pintada,,,"R$ 58,90"
E se não houvesse amanhã?,Bella Falconi,United Press,128,16x23 Cm,340g,Brochura Com Borda Lateral Colorida,,2020,"R$ 43,90"
Bíblia Pregação Expositiva | RA |PU luxo preto,Hernandes Dias Lopes,Hagnos,1.888,16x23 Cm,1120g,PU Luxo Preto Com Borda Dourada,,2020,"R$ 277,91"
15 Lições para criação de filhos,David Merkh,Hagnos,240,,,Brochura Com Borda Pintada,,2020,"R$ 40,90"
Teologia sistemática de Strong - Vol 1 e 2 - nova edição,Augusto Hopkins Strong,Hagnos,1918,16x23cm,2260g,Brochura,,,"R$ 291,89"
Teologia sistemática Charles Hodge,,,,,,,,,"R$ 245,90"
Seguindo a deus de todo o coração,Elizabeth George,United Press,257,14x21cm,280g,Brochura,,,"R$ 49,90"
Pregação transformadora,Hernandes Dias Lopes,Hagnos,224,16x23cm,280g,Brochura,,2020,"R$ 45,90"
Pastores em perigo,Jaime Kemp,Hagnos,,14x21cm,280g,Brochura,,,"R$ 48,90"
Nova Bíblia Viva - Sarom (Capa Dura),,Hagnos,1056,14x21cm,520g,Capa Dura Com Borda Pintada,,,"R$ 58,90"
Nova Bíblia Viva - Escudo (capa dura),,Hagnos,1056,14x21cm,442g,Capa Dura,,,"R$ 58,90"
Milagres e parábolas do nosso Senhor - Spurgeon,Charles H. Spurgeon,Hagnos,1616,16x23cm,1960g,Capa Dura,,,"R$ 291,89"
Mães intercessoras - nova edição,Hernandes Dias Lopes,United Press,144,14x21 Cm,220g,Brochura,,2020,"R$ 36,90"
Igreja corpo vivo de Cristo,Hernandes Dias Lopes,Hagnos,144,14x21cm,180g,Brochura,,,"R$ 36,90"
Histórias para corações românticos,,,,,,,,,"R$ 22,90"
Guerra espiritual,Hernandes Dias Lopes,Hagnos,152,14x21cm,230g,Brochura,,2020,"R$ 41,90"
"Esperança, o perfume do coração - Spurgeon",Charles H. Spurgeon,Hagnos,224,16x23cm,370g,Capa Dura,,,"R$ 52,90"
Economia e fé no início da era crista,Justo González,Hagnos,352,16x23cm,,Brochura,,,"R$ 65,90"
Doze homens uma missão,Aramis C. DeBarros,Hagnos,528,16x23cm,580g,Brochura,,,"R$ 78,90"
Deixe Deus escrever sua historia,Nancy Demoss Wolgemuth,United Press,256,14x21cm,280g,Brochura,,,"R$ 44,90"
De todo coração,Luciano Subirá,United Press,224,16x23cm,300g,Brochura,,2020,"R$ 40,90"
Como lidar com a teimosia do seu filho,James Dobson,United Press,144,16x23cm,200g,Brochura,,,"R$ 39,90"
Bíblia sonho de princesa,Marilene Terrengui,United Press,352,14x21cm,560g,Capa Dura Com Cantos Arredondados,,,"R$ 56,90"
Bíblia de recursos para o ministério com crianças - APEC - Luxo PU marrom,APEC,Hagnos,1980,16x23cm,1300g,Luxo PU Marrom,,,"R$ 280,90"
A arte de sabotar a própria vida,Michel Uchoa,Unidet Press,208,16X23cm,200g,Brochura Com Borda Pintada,,,"R$ 36,90"
151 reflexões sobre a educação de filhos,David Merkh,United Press,240,14x21cm,260g,Brochura,,,"R$ 36,90"
15 lições para transformar seu casamento,David Merkh,Hagnos,240,16x23cm,320g,Brochura Com Borda Pintada,,2020,"R$ 40,90"
O sorriso de Sara - Série era uma vez na bíblia,Israel Belo,United Press,32,25x19 Cm,80g,Brochura,,,"R$ 12,90"
O homem que gostava de enganar - Série era uma vez na bíblia,Israel Belo,United Press,32,25x19 Cm,80g,Brochura,,,"R$ 12,90"
Escolhas e Alianças,Hernandes Dias Lopes,Hagnos,80,14x21cm,250g,Brochura,,2019,"R$ 29,90"
Oração de poder segundo o coração de Deus,Wesley Duewel,United Press,368,16x23cm,300g,Brochura,,2019,"R$ 53,90"
Noções básicas de hebraico bíblico,Teresa Akil,Hagnos,112,20x27cm,280g,Brochura,,2007,"R$ 41,90"
O namoro e o noivado que Deus sempre quis,David Merkh,United Press,272,14x21cm,280g,Brochura,,2013,"R$ 44,90"
Mulheres que amaram a Deus,Elizabeth George,United Press,384,16x23,,Brochura,,2009,"R$ 59,90"
Uma mulher segundo o coração de Deus,Elizabeth George,United Press,272,14x21cm,320g,Brochura,,2013,"R$ 51,90"
Uma mulher que reflete o coração de Jesus,Elizabeth George,United Press,288,14x21cm,280g,Brochura,,2016,"R$ 45,90"
Mensagens selecionadas para a vida,Hernandes Dias Lopes,United Press,232,14x21cm,240g,Brochura,,2016,"R$ 37,90"
O melhor da espiritualidade,Hernandes Dias Lopes,United Press,480,16x23cm,760g,Capa Dura,,2018,"R$ 73,90"
Meditações da mulher segundo o coração de Deus,Elizabeth George,United Press,176,14x21cm,180g,Brochura,,2018,"R$ 35,90"
Manual do capelão,Gisleno Gomes De Faria Alves,United Press,336,14x21cm,340g,Brochura,,2017,"R$ 47,90"
Mãe segundo o coração de Deus,Elizabeth George,United Press,264,14x21cm,280g,Brochura,,2006,"R$ 47,90"
O legado dos avós,David Merkh,United Press,256,14x21cm,260g,Brochura,,2001,"R$ 39,90"
Heresia,Alister Mcgrath,Hagnos,296,16x23cm,400g,Brochura,,2014,"R$ 58,90"
Em seus passos que faria Jesus?,Charles M. Sheldon,United Press,112,11x15cm,60g,Brochura,,2009,"R$ 16,90"
Educando filhas segundo o coração de Deus,Elizabeth George,United Press,232,14x21cm,280g,Brochura,,2014,"R$ 42,90"
O cristão verdadeiro,D.A Carson,Hagnos,176,14cm X 21cm,200g,Brochura,,2018,"R$ 42,90"
O evangelho de Deus e o evangelho do homem,Paul Washer,Hagnos,120,14cm X 21cm,140g,Brochura,,2018,"R$ 39,90"
O resgate do pensamento Bíblico,John MacArthur,Hagnos,432,16cm X 21cm,600g,Brochura,,2018,"R$ 72,90"
O período interbíblico,Enéas Tognini,Hagnos,224,14cm X 21cm,320g,Brochura,,2009,"R$ 52,90"
O poder da oração pelo casamento,Elizabeth George,United Press,256,14cm X 21cm,260g,Brochura,,2018,"R$ 42,90"
Racionalidade da fé cristã,J.P. Moreland,Hagnos,336,16cm X 23cm,460g,Brochura,,,"R$ 47,90"
Nova Bíblia Viva - Ondas (Capa Dura),,Hagnos,1056,14x21cm,680g,Capa Dura Com Borda Pintada,,2019,"R$ 58,90"
E se Deus for contra nós?,Augustus Nicodemus,Hagnos,160,14x21cm,180g,Brochura,,2018,"R$ 39,90"
Seu amor é melhor que chocolate,Marilene Terrengui E Juan Martinez,United Press,72,"17,5cm X 17,5cm",240g,Capa Dura,,2018,"R$ 36,90"
A essência da verdadeira adoração,John MacArthur,Hagnos,208,16x23cm,340g,Brochura,,2018,"R$ 42,90"
Teologia do Novo Testamento - Ladd,George Eldon Ladd,Hagnos,904,16cm X 23cm,1200g,Capa Dura,,2003,"R$ 187,90"
Fogo do avivamento,Wesley L. Duewel,United Press,280,16x23cm,360g,Brochura,,2016,"R$ 43,90"
Fica a dica - 100 atitudes que podem mudar o dia a dia do sexo no seu casamento,Darrel Marinho,United Press,128,14x21cm,140g,Brochura,,2017,"R$ 31,90"
Fica a dica - 100 atitudes que podem mudar o dia a dia do seu casamento,Darrel Marinho,United Press,128,14x21cm,140g,Brochura,,2017,"R$ 31,90"
Toque o mundo por meio da oração,Wesley L. Duewel,United Press,304,16cm X 23cm,400g,Brochura,,2014,"R$ 42,90"
O evangelho segundo Deus,John MacArthur,Hagnos,224,16x23cm,340g,Brochura,,2018,"R$ 47,90"
Espiritualidade emocionalmente saudável - GUIA DE ESTUDOS,Peter Scazzero,United Press,72,16x23cm,120 G,Brochura,,2014,"R$ 23,90"
Espiritualidade emocionalmente saudável,Peter Scazzero,United Press,284,16x23cm,380g,Brochura,,,"R$ 46,90"
Devocional para casais,Jaime E Judith Kemp,Hagnos,384,16x23cm,700g,Capa Dura,,,"R$ 58,90"
A arte de permanecer casado,Jaime Kemp,United Press,180,14x21cm,240g,Brochura,,,"R$ 47,90"
"O Antigo Testamento, um olhar atento","Josef Schreiner , Organizador",Hagnos,488,16x23cm,640g,Brochura,,,"R$ 99,90"
Bela aos olhos de Deus,Elizabeth George,United Press,288,14cm X 21cm,320g,Brochura,,2003,"R$ 44,90"
A reforma protestante,Ricardo Bitun,Hagnos,112,14x21cm,160g,Brochura,,,"R$ 29,90"
77 perguntas sobre Deus e a Bíblia,Josh McDowell,United Press,320,14x21cm,320g,Brochura,,,"R$ 49,90"
50 Segredos para o líder,Josué Campanha,United Press,224,16x23cm,340g,Brochura,,,"R$ 38,90"
31 Coisas que toda mulher deve saber,Elizabeth George,United Press,304,14x21cm,350g,Brochura,,2019,"R$ 49,90"
Uma breve história das doutrinas cristãs,Justo Gonzales,Hagnos,256,16cm X 23cm,360g,Brochura,,2015,"R$ 50,90"
A caminhada de uma mulher com Deus,Elizabeth George,United Press,272,14cm X 21cm,300g,Brochura,,2004,"R$ 47,90"
101 Idéias criativas para culto doméstico,David J. Merkh,Hagnos,136,14x21cm,160g,Brochura,,,"R$ 33,90"
Um casal segundo coração de Deus,Elizabeth George,United Press,280,14cm X 21cm,280 G,Brochura,,2015,"R$ 44,90"
A Bíblia dos pequeninos,,United Press,448,15x18cm,680g,Capa Flexível,,,"R$ 53,90"
Atlas bíblico ilustrado,André Daniel Reinke,Hagnos,128,21x28cm,640g,Capa Dura Com Espiral,,,"R$ 98,90"
Novo dicionário bíblico CHAMPLIN,Russel N Champlin,Hagnos,1856,16x23cm,2020g,Capa Dura,,2018,"R$ 333,89"
Novo dicionário da Bíblia – Ampliado e atualizado - J. Davis,John D. Davis,Hagnos,1304,16x23cm,1620g,Capa Dura,,,"R$ 278,90"
Como fazer escolhas certas,Elizabeth George,United Press,208,14cm X 21cm,220g,Brochura,,2014,"R$ 42,90"
Enciclopédia de fatos da Bíblia,Mark Water,Hagnos,960,16x23cm,1010g,Capa Dura,,,"R$ 205,91"
Dicionário global de teologia,William A. Dyrness E Veli-Matti Kärkkäinen,Hagnos,1062,16x23cm,1260g,Capa Dura,,,"R$ 215,91"
Comentário Biblico Swindoll - João,Charles R. Swindoll,Hagnos,384,16x23cm,480g,Brochura,,,"R$ 69,90"
Comentário Bíblico Swindoll - 1 e 2 Timóteo e Tito,Charles R. Swindoll,Hagnos,384,16x23cm,520g,Brochura,,,"R$ 69,90"
Comentário Expositivo Charles Spurgeon - MATEUS,Charles H. Spurgeon,Hagnos,654,16x23cm,900g,Capa Dura,,,"R$ 152,90"
"Deus, revelação e autoridade - Volume 2",Carl F. H. Henry,Hagnos,546,16x23cm,760g,Capa Dura,,,"R$ 115,90"
"Deus, revelação e autoridade",Carl F. H. Henry,Hagnos,624,16x23cm,840g,Capa Dura,,,"R$ 125,90"
Coração em chamas pelo Espírito,Wesley L. Duewel,United Press,288,16x23cm,400g,Brochura,,,"R$ 56,90"
Nova Bíblia Viva - Clássica,,Hagnos,1056,14x21cm,442g,Brochura Flexível,,,"R$ 45,90"
A Bíblia em Esboços,Harold Willmigton,Hagnos,776,16x23cm,940g,Capa Dura,,,"R$ 195,90"
Naum e Sofonias - Comentários Expositivos,Hernandes Dias Lopes,Hagnos,140,14x21cm,220g,Brochura,,2019,"R$ 39,90"
Quando a Família corre perigo,Márcia & Darrell Marinho,United Press,176,16x23cm,270g,Brochura,,2019,"R$ 34,90"
Eu declaro Guerra,Levi Lusko,United Press,208,16x23cm,270g,Brochura Com Borda Pintada Preta,,2019,"R$ 42,90"
Não era para ser assim,Lisa Tekeurst,United Press,272,16x23cm,280g,Brochura,,2019,"R$ 44,90"
Quando Cristo vive em nós,Justo Gonzáles,United Press,128,14cm X 21cm,140g,Brochura,,2016,"R$ 33,90"
Enciclopédia de Bíblia teologia e filosofia - 6 Volumes,Russel N Champlin,Hagnos,5230,17x24cm,6900g,Capa Dura,,,"R$ 895,92"
Família S/A,Josué Campanhã,Hagnos,240,16x23cm,340g,Brochura,,2008,"R$ 36,90"
Lideres que frutificam,Josué Campanhã,United Press,168,14x21cm,180g,Brochura,,2011,"R$ 30,90"
Ministério: vocação ou profissão?,Justo González,Hagnos,176,14x21cm,200g,Brochura,,2012,"R$ 38,90"
Homem nota 10,David Merkh,United Press,208,14x21cm,200g,Brochura,,2015,"R$ 38,90"
As cronicas de Aedyn - O voo dos exilados - Vol. 2,Alister Mcgrath,United Press,160,14x21cm,180g,Brochura,,,"R$ 29,90"
As cronicas de Aedyn - O desvanecer das trevas - Vol. 3,Alister Mcgrath,United Press,200,14x21cm,220g,Brochura,,,"R$ 29,90"
Um homem segundo o coração de Deus,Jim George,United Press,240,14x21cm,260g,Brochura,,2003,"R$ 44,90"
Novo Testamento Interpretado - 6 volumes,Russel N Champlin,Hagnos,5474,21x28cm,10560g,Capa Dura,,,"R$ 1.322,91"
Espiritualidade Emocionalmente Saudável Dia A Dia,Peter Scazzero,United Press,176,14x21cm,160g,Brochura,,2017,"R$ 23,90"
Os dez mandamentos nos dias de hoje,Israel Belo De Azevedo,United Press,256,14x21cm,260g,Brochura,,2016,"R$ 41,90"
História do movimento missionário,Justo González,Hagnos,544,16x23cm,660g,Capa Dura,,2010,"R$ 96,90"
Todo filho precisa de uma mãe que ora,Fern Nichols / Janet Kobobel Grant,United Press,320,14cm X 21cm,360g,Brochura,,2005,"R$ 51,90"
O líder emocionalmente saudável,Peter Scazzero,United Press,320,16x23cm,460g,Brochura,,2016,"R$ 47,90"
Mãe 24 horas,Stacey Thacker,United Press,224,14x21cm,240g,Brochura,,2017,"R$ 36,90"
Novo dicionário de teologia - Sinclair,"Sinclair B. Ferguson , David Wright",Hagnos,1224,16x23cm,1400g,Capa Dura,,,"R$ 236,89"
O chamado de Cristo para reformar a igreja,John MacArthur,Hagnos,192,16x23cm,270g,Brochura,,,"R$ 40,90"
Nada pode calar uma mulher de Fé,Eyshila Santos,United Press,240,16x23cm,280g,Brochura,,2019,"R$ 39,90"
"Cheio de Deus, cheio do Espírito",Wesley L. Duewel,United Press,192,16cm X 23cm,270g,Brochura,,2019,"R$ 38,90"
Mateus - Comentários Expositivos,Hernandes Dias Lopes,Hagnos,832,14x21cm,720g,Brochura,,,"R$ 160,90"
Pedagogia Bíblica divertida,Helenita Borja,United Press,176,20cm X 27cm,380g,Brochura,,2004,"R$ 37,90"
Teologia do Antigo Testamento,,Hagnos,970,16cm X 23cm,1340g,Capa Dura,,2005,"R$ 233,90"
Atlas da Bíblia,,Hagnos,496,16cm X 23cm,840g,Brochura,,2018,"R$ 119,90"
101 Idéias criativas para mulheres,Mary-Ann Cox,Hagnos,104,,160g,Brochura,,,"R$ 33,90"
Vamos construir a arca de Noé,Andre Daniel Reinke,United Press,16,21cm X 30cm,280g,Brochura,,2015,"R$ 45,90"
O mistério da montanha,Paulo Debs,United Press,32,18x25cm,80g,Brochura,,,"R$ 16,90"
Vamos construir o templo da época de Jesus?,Andre Daniel Reinke,United Press,16,21cm X 30cm,280g,Brochura,,2011,"R$ 45,90"
Perguntas e respostas sobre o namoro e o noivado,"David Merkh , Alexandre Mendes",United Press,272,14cm X 21cm,300g,Brochura,,2015,"R$ 42,90"
Começando Juntos,H. Norman Wright,United Press,224,14cm X 21cm,240g,,,2005,"R$ 41,90"
Descobrindo o caminho de Deus nas provações,Elizabeth George,United Press,304,14x21cm,360g,Brochura,,,"R$ 52,90"
O mito da família perfeita,Israel Belo De Azevedo,United Press,144,14x21cm,160g,Brochura,,2010,"R$ 32,90"
O prazer da produção cientifica,Israel Belo De Azevedo,United Press,264,16cm X 23cm,400g,Brochura,,2012,"R$ 48,90"
"Grandes igrejas, pequenos líderes",Josué Campanhã,United Press,208,16x23cm,280g,Brochura,,2011,"R$ 37,90"
Breve dicionário de teologia,Justo Gonzalez,Hagnos,344,16x23cm,580g,Capa Dura,,,"R$ 80,90"
Enciclopédia do Protestantismo,Pierre Gisel & Lucie Kaennel,Hagnos,1936,16x23cm,2060g,Capa Dura,,,"R$ 380,88"
Preocupação - Um habito que pode ser quebrado,Elizabeth George,United Press,184,14x21cm,200g,Brochura,,2011,"R$ 28,90"
O Deus de Israel,Landon Jones,Hagnos,360,16x23cm,480g,Brochura,,,"R$ 58,90"
Mais que um carpinteiro,Josh Mcdowell,United Press,192,14x21cm,220g,Brochura,,2012,"R$ 40,90"
Jesus de Nazaré,Samuel Pagán,Hagnos,240,16x23cm,320g,Brochura,,2015,"R$ 40,90"
Revista sonho de princesa - Vamos colorir | Livro de atividades,Marilene Terrengui,United Press,16,16x23cm,60g,Brochura,,2019,"R$ 11,90"
101 Idéias criativas para família,David E Carol Sue Merkh,Hagnos,144,14x21cm,180g,Brochura,,,"R$ 36,90"
Teologia Sistemática de Chafer - 2 volumes,Lewis Sperry Chafer,Hagnos,2576,17x26 Cm,3100g,Capa Dura,,,"R$ 381,88"
101 Idéias criativas para professores,David Merkh,Hagnos,188,14x21cm,200g,Brochura,,,"R$ 40,90"
101 Idéias criativas para grupos pequenos,David J. Merkh,Hagnos,104,14x21cm,160g,Brochura,,,"R$ 29,90"
O papado e o dogma de maria,Hernandes Dias Lopes,Hagnos,136,,,Brochura,,2005,"R$ 32,90"
Bíblia de recursos para o ministério com crianças - APEC - Luxo PU preta,APEC,Hagnos,1980,16x23cm,1300g,Luxo PU Preto,,,"R$ 280,90"
O sucesso não cabe na bolsa,Patricia Lages,United Press,232,16.00cm X 23.00cm,320 Gramas,Brochura,,2018,"R$ 41,90"
O Humor no Antigo Testamento,Milton Acosta,Hagnos,264,16x23cm,360g,,,2018,"R$ 49,90"
Homens De Oração,Hernandes Dias Lopes,United Press,128,14x21cm,100g,Brochura,,2019,"R$ 38,90"
Removendo máscaras,Hernandes Dias Lopes,United Press,80,14.00cm X 21.00cm,100 Gramas,Brochura,,2004,"R$ 28,90"
A poderosa voz de Deus,Hernandes Dias Lopes,Hagnos,112,14.00cm X 21.00cm,120 Gramas,Brochura,,2002,"R$ 26,90"
Súplicas do mundo,Hernandes Dias Lopes,United Press,112,14.00cm X 21.00cm,120 Gramas,Brochura,,2010,"R$ 28,90"
Oito homens que influenciaram o mundo,Hernandes Dias Lopes,United Press,96,14.00cm X 21.00cm,120 Gramas,Brochura,,2009,"R$ 29,90"
"Pai, Um homem de valor",Hernandes Dias Lopes,United Press,112,14.00cm X 21.00cm,140 Gramas,Brochura,,2008,"R$ 32,90"
Voando nas alturas,Hernandes Dias Lopes,United Press,80,14.00cm X 21.00cm,80 Gramas,Brochura,,2015,"R$ 28,90"
Perdão a cura das emoções,,,80,14.00cm X 21.00cm,100 Gramas,,,,"R$ 26,90"
Ladroes da alegria,Hernandes Dias Lopes,,80,14x21cm,120 G,,,,"R$ 35,90"
Não desista dos seus sonhos,Hernandes Dias Lopes,United Press,80,14x21cm,80g,Brochura,,2015,"R$ 26,90"
Sofrimento o preço da missão,,,144,14x21cm,160g,,,,"R$ 37,90"
As teses de satanás,Hernandes Dias Lopes,United Press,88,14.00cm X 21.00cm,120 Gramas,Brochura,,2014,"R$ 30,90"
Pregação expositiva,Hernandes Dias Lopes,Hagnos,280,14x21cm,360g,Brochura,,2008,"R$ 61,90"
Não desista de você,Hernandes Dias Lopes,United Press,200,14x21cm,220g,Brochura,,2015,"R$ 40,90"
Para onde caminha a igreja,Hernandes Dias Lopes,United Press,120,14.00cm X 21.00cm,140 Gramas,Brochura,,2013,"R$ 33,90"
Vencendo gigantes,Hernandes Dias Lopes,United Press,80,14.00cm X 21.00cm,100 Gramas,Brochura,,2005,"R$ 29,90"
Provérbios - Comentários Expositivos Hagnos,Hernandes Dias Lopes,Hagnos,648,14x21cm,520g,Brochura,,,"R$ 129,90"
Obadias e Ageu - Comentários Expositivos,Hernandes Dias Lopes,Hagnos,136,14x21cm,160g,Brochura,,,"R$ 37,90"
Oseias - Comentários Expositivos,Hernandes Dias Lopes,Hagnos,258,14x21cm,300g,Brochura,,,"R$ 63,90"
Filipenses - Comentários Expositivos,Hernandes Dias Lopes,Hagnos,264,14x21cm,300g,Brochura,,,"R$ 66,90"
2 Pedro E Judas - Comentários Expositivos,Hernandes Dias Lopes,Hagnos,144,14x21cm,160g,Brochura,,,"R$ 40,90"
Amós - Comentários Expositivos Hagnos,Hernandes Dias Lopes,Hagnos,216,14x21cm,240g,Brochura,,,"R$ 53,90"
Gálatas - Comentários Expositivos Hagnos,Hernandes Dias Lopes,Hagnos,288,14x21cm,320g,Brochura,,,"R$ 52,90"
Efésios - Comentários Expositivos,Hernandes Dias Lopes,Hagnos,192,14x21cm,220g,Brochura,,,"R$ 46,90"
Tito e Filemom - Comentários Expositivos,Hernandes Dias Lopes,Hagnos,168,14x21cm,190g,Brochura,,,"R$ 41,90"
De pastor a pastor,Hernandes Dias Lopes,Hagnos,168,14x21cm,180g,Brochura,,,"R$ 47,90"
Piedade e paixão,Hernandes Dias Lopes,United Press,96,14.00cm X 21.00cm,100 Gramas,Brochura,,2016,"R$ 32,90"
1 e 2 Tessalonicenses - Comentários Expositivos,Hernandes Dias Lopes,Hagnos,238,14x21cm,260g,Brochura,,,"R$ 55,90"
Joel - Comentários Expositivos Hagnos,Hernandes Dias Lopes,Hagnos,120,14x21cm,140g,Brochura,,,"R$ 33,90"
Rute - Comentários Expositivos Hagnos,Hernandes Dias Lopes,Hagnos,160,14x21cm,160 Gramas,Brochura,,,"R$ 39,90"
2 Corintios - Comentários Expositivos,Hernandes Dias Lopes,Hagnos,296,14x21cm,360g,Brochura,,,"R$ 68,90"
Malaquias - Comentários Expositivos,Hernandes Dias Lopes,Hagnos,136,14x21cm,160g,Brochura,,,"R$ 37,90"
"Riqueza, a prosperidade que vem de Deus",Hernandes Dias Lopes,United Press,112,14cm X 21cm,120 Gramas,Brochura,,2009,"R$ 28,90"
Destinados para a glória,Hernandes Dias Lopes,United Press,96,14x21cm,120,Brochura,,,"R$ 29,90"
A Felicidade ao seu alcance,Hernandes Dias Lopes,Hagnos,136,14x21cm,160g,,,2008,"R$ 34,90"
Dízimos e ofertas são para hoje?,Hernandes Dias Lopes,United Press,112,14x21cm,160g,Brochura,,2017,"R$ 32,90"
Casamento divorcio e novo casamento,Hernandes Dias Lopes,United Press,152,14.00cm X 21.00cm,180 Gramas,Brochura,,2005,"R$ 37,90"
"1, 2, 3 João - Comentários Expositivos",Hernandes Dias Lopes,Hagnos,272,14x21cm,280g,Brochura,,,"R$ 64,90"
Colossenses - Comentários Expositivos,Hernandes Dias Lopes,Hagnos,232,14x21cm,260g,Brochura,,,"R$ 54,90"
Marcos - Comentários Expositivos Hagnos,Hernandes Dias Lopes,Hagnos,640,14x21cm,580g,Brochura,,,"R$ 129,90"
Fome de Deus,Hernandes Dias Lopes,Hagnos,96,14x21cm,120 G,Brochura,,2004,"R$ 29,90"
Parábola do bambu,,,96,14.00cm X 21.00cm,100 Gramas,,,,"R$ 29,90"
João - Comentários Expositivos Hagnos,Hernandes Dias Lopes,Hagnos,520,14x21cm,460g,Brochura,,,"R$ 106,90"
Jonas - Comentários Expositivos Hagnos,Hernandes Dias Lopes,Hagnos,128,14x21cm,160g,Brochura,,,"R$ 36,90"
Segunda vinda de cristo,Hernandes Dias Lopes,United Press,112,14.00cm X 21.00cm,140,Brochura,,2010,"R$ 28,90"
Tiago - Comentários Expositivos Hagnos,Hernandes Dias Lopes,Hagnos,160,14x21cm,180g,Brochura,,,"R$ 41,90"
1 Timóteo - Comentários Expositivos,Hernandes Dias Lopes,Hagnos,160,14x21cm,180g,Brochura,,,"R$ 41,90"
Miqueias - Comentários Expositivos,Hernandes Dias Lopes,Hagnos,176,14x21cm,200g,Brochura,,,"R$ 43,90"
2 Timóteo - Comentários Expositivos,Hernandes Dias Lopes,Hagnos,144,14x21cm,160g,Brochura,,,"R$ 40,90"
Daniel - Comentários Expositivos Hagnos,Hernandes Dias Lopes,Hagnos,160,14x21cm,180g,Brochura,,,"R$ 39,90"
Neemias - Comentários Expositivos Hagnos,Hernandes Dias Lopes,Hagnos,224,14x21cm,240g,Brochura,,,"R$ 59,90"
1 Coríntios - Comentários Expositivos,Hernandes Dias Lopes,Hagnos,312,14x21cm,340,Brochura,,,"R$ 71,90"
Lucas - Comentários Expositivos,Hernandes Dias Lopes,Hagnos,712,14x21cm,600,Brochura,,,"R$ 136,90"
Habacuque - Comentários Expositivos,Hernandes Dias Lopes,Hagnos,160,14x21cm,180g,Brochura,,,"R$ 41,90"
Apocalipse - Comentários Expositivos Hagnos,Hernandes Dias Lopes,Hagnos,408,14x21cm,440g,Brochura,,,"R$ 99,90"
Atos - Comentários Expositivos Hagnos,Hernandes Dias Lopes,Hagnos,512,14x21cm,460g,Brochura,,,"R$ 110,90"
Revitalizando a igreja,Hernandes Dias Lopes,United Press,144,14.00cm X 21.00cm,180 Gramas,Brochura,,2012,"R$ 37,90"
Romanos - Comentários Expositivos Hagnos,Hernandes Dias Lopes,Hagnos,192,14x21cm,220g,Brochura,,,"R$ 109,90"
1 Pedro - Comentários Expositivos Hagnos,Hernandes Dias Lopes,Hagnos,192,14x21cm,220g,Brochura,,,"R$ 46,90"
"Quatro homens, um destino",Hernandes Dias Lopes,Hagnos,120,14.00cm X 21.00cm,160 Gramas,Brochura,,2007,"R$ 37,90"
Não desanime Jesus esta no controle,Hernandes Dias Lopes,United Press,61,14x21cm,80g,Brochura,,2017,"R$ 26,90"
Mulher nota 10,Hernandes Dias Lopes,United Press,80,14x21cm,100g,Brochura,,2013,"R$ 31,90"
Aprendendo a orar com quem ora,Hernandes Dias Lopes,United Press,160,14x21cm,180g,,,,"R$ 40,90"
Mensagens selecionadas para a família,Hernandes Dias Lopes,United Press,192,14x21cm,240g,Brochura,,2017,"R$ 37,90"
Restaurando a família,Hernandes Dias Lopes,United Press,96,14.00cm X 21.00cm,100g,Brochura,,2017,"R$ 28,90"
Prosperando no deserto,Hernandes Dias Lopes,United Press,96,14.00cm X 21.00cm,100 Gramas,Brochura,,2016,"R$ 30,90"
Pedro - o pescador de homens,Hernandes Dias Lopes,Hagnos,128,14x21cm,180g,Brochura,,2015,"R$ 44,90"
Paulo - o maior líder do cristianismo,Hernandes Dias Lopes,Hagnos,160,14 X 21cm,180 Gramas,Brochura,,2009,"R$ 44,90"
Pentecoste,Hernandes Dias Lopes,United Press,128,14.00cm X 21.00cm,160 Gramas,Brochura,,2017,"R$ 38,90"
Hebreus - Comentários Expositivos,Hernandes Dias Lopes,Hagnos,320,14x21cm,240g,Brochura,,,"R$ 72,90"
Panorama da historia cristã,Hernandes Dias Lopes,Hagnos,120,14.00cm X 21.00cm,120 G,Brochura,,2018,"R$ 31,90"
Devocional sabedoria Viva - Capa luxo,Hernandes Dias Lopes,Hagnos,384,14x21cm,400g,Capa Dura Com Borda Dourada,,2018,"R$ 51,90"
