Título,Autor,Editora,Páginas,Formato,Peso,Acabamento,Categoria,Edição,Preço
Homem: o local onde Deus habita,A.W. TOZER,Hagnos,208,14 X 21 Cm,300g,Capa Dura Com Borda Pintada,,2020,"R$ 40,90"
O cristão surpreendente,A.W. TOZER,Hagnos,192,14 X 21 Cm,300g,Capa Dura Com Borda Pintada,,2021,"R$ 39,90"
Kit Espiritualidade,,,,,,,,,"R$ 119,70"
Kit Caminhos da vida,,,,,,,,,"R$ 84,80"
Kit Vida transformada,,,,,,,,,"R$ 92,80"
El Nuevo Testamento interpretado | Tomo 1 - (VERSÃO ESPANHOL),Russel N. Champlin,Hagnos,876,21 X 28 Cm,19g,Capa Dura,,,"R$ 189,90"
El Nuevo Testamento interpretado | Tomo 2 - (VERSÃO ESPANHOL),Russel N. Champlin,Hagnos,792,21 X 28 Cm,17g,Capa Dura,,,"R$ 189,90"
Dicionário da Bíblia Eerdmans,Editado Por: David Noel Freedman,Hagnos,1536,16x23cm,186,Capa Dura,,2021,"R$ 279,91"
Desvios,Tony Evans,Hagnos,224,14 X 21cm,260g,Brochura,,2022,"R$ 42,90"
A Cultura do Jejum,Luciano Subirá,Hagnos,272,16x23 Cm,360g,Brochura,,2022,"R$ 44,90"
Decifrando as palavras difíceis de Jesus,Amy-Jill Levine,Hagnos,208,16x23 Cm,,Brochura,,2022,"R$ 40,90"
As palavras e as obras de Jesus,John Dwight Pentecost,Hagnos,848,16x23 Cm,1140g,Capa Dura,,2022,"R$ 176,90"
Devocional Gotas de Sabedoria Para a Vida,Hernandes Dias Lopes,Hagnos,380,11 X 15 Cm,220g,Brochura,,2021,"R$ 15,90"
Devocional Gotas de Consolo Para Alma,Hernandes Dias Lopes,Hagnos,380,11 X 15 Cm,220g,Brochura,,,"R$ 15,90"
Devocional Gotas de Alegria Para Alma,Hernandes Dias Lopes,Hagnos,380,11 X 15 Cm,220g,Brochura,,2021,"R$ 15,90"
Devocional Gotas de Amor Para a Alma,Hernandes Dias Lopes,Hagnos,380,11 X 15 Cm,220g,Brochura,,2021,"R$ 15,90"
Devocional Gotas de Sabedoria Para a Alma,Hernandes Dias Lopes,Hagnos,380,11 X 15 Cm,220g,Brochura,,2021,"R$ 15,90"
Devocional Gotas de Paz Para a Alma,Hernandes Dias Lopes,Hagnos,380,11 X 15 Cm,220g,Brochura,,2021,"R$ 15,90"
Kit Pregação Transformadora,,,,,,,,,"R$ 224,10"
,,,,,,,,,
Conversões,Tony Evans,Hagnos,224,14x21cm,240g,Brochura,,2022,"R$ 41,90"
O Grande Deus - Spurgeon,Charles H. Spurgeon,Hagnos,192,16x23 Cm,400g,Capa Dura,,2022,"R$ 46,90"
Geografia da terra santa e das terras Bíblicas,Enéas Tognini,Hagnos,544,16x23cm,750g,Brochura,,2009,"R$ 105,90"
Manual prático para a vida,Hernandes Dias Lopes,Hagnos,352,16x23 Cm,320g,Brochura + Borda Pintada,,2022,"R$ 66,90"
Comentário Bíblico Swindoll - Mateus,Charles R. Swindoll,Hagnos,656,16x23 Cm,880g,Brochura,,2022,"R$ 118,90"
Como eu cheguei até aqui?,Christine Caine,Hagnos,224,16x23 Cm,220g,Brochura + Lateral Pintada,,2021,"R$ 37,90"
"Vida, a grande escola de Deus",Hernandes Dias Lopes,Hagnos,304,16x23 Cm,420g,Brochura,,2021,"R$ 49,90"
Ainda não é o fim,Augustus Nicodemus,Hagnos,128,14x21 Cm,300g,Brochura Com Pintura Lateral,,2022,"R$ 34,90"
O que Jesus disse sobre o Espírito Santo,Tim Woodroof,Hagnos,304,16x23 Cm,420g,Brochura Com Pintura Lateral,,2022,"R$ 48,90"
Shalom para o coração,Evan Moffic,Hagnos,176,14x21 Cm,200g,Brochura,,2022,"R$ 33,90"
Cuidando da Alma das crianças,Amy Baker,Hagnos,352,16x23,320g,Brochura,,2022,"R$ 59,90"
O que acontece quando uma mulher caminha pela Fé,Lysa Terkeurst,Hagnos,224,16x23 Cm,,Brochura Com Borda Pintada,,2022,"R$ 41,90"
Lições de liderança de Agostinho,Edward L. Smither,Hagnos,320,16x23 Cm,,Brochura Com Borda Pintada,,2022,"R$ 48,90"
Depois de dizer Amém,Rusty George,Hagnos,192,16 X 23 Cm,,Brochura Com Borda Pintada,,2022,"R$ 40,90"
Nova Bíblia Viva - Cantares (Capa Dura),,Hagnos,1056,14x21cm,520g,Capa Dura Com Borda Pintada,,,"R$ 58,90"
Nova Bíblia Viva - Isaías,,Hagnos,1056,14x21cm,442g,Brochura Flexível,,,"R$ 45,90"
Nova Bíblia Viva - Bendito o Rei (Capa Dura),,Hagnos,1056,14x21cm,520g,Capa Dura Com Borda Pintada,,,"R$ 58,90"
Minha história vai impactar a sua,Hernandes Dias Lopes,Hagnos,192,14x21 Cm,240g,Brochura,,2022,"R$ 46,90"
Perguntas para a mente e o coração - Spurgeon,Charles Haddon Spurgeon,Hagnos,304,16x23cm,420g,Brochura,,2022,"R$ 52,90"
O poder das palavras de uma mulher,Sharon Jaynes,Hagnos,288,16x23 Cm,360g,Brochura,,2022,"R$ 48,90"
Salmos - Comentários Expositivos Hagnos | Vol. 1 & 2,Hernandes Dias Lopes,Hagnos,Vol. 1 - 784 Páginas,14x21 Cm,1220g,Brochura,,2022,"R$ 315,90"
Bíblia de recursos para o ministério com crianças - APEC - Luxo PU Rosa,APEC,Hagnos,1980,16x23cm,1300g,Luxo PU Rosa,,,"R$ 280,90"
Caminhos,Tony Evans,Hagnos,224,14x21 Cm,240g,Brochura,,2022,"R$ 41,90"
Convite ao encorajamento,Hernandes Dias Lopes,Hagnos,112,14x21 Cm,130g,Brochura,,2022,"R$ 28,90"
Bíblia Sagrada - NVI - Salmos c/ plano leitura,,Hagnos,1072,14x21 Cm,560g,Capa Dura + Borda Pintada,,2022,"R$ 56,90"
Bíblia Sagrada - NVI - Provérbios c/ plano leitura,,Hagnos,1072,14x21 Cm,560g,Capa Dura + Borda Pintada,,2022,"R$ 56,90"
Bíblia Sagrada - NVI - Jardim de Deus c/ plano leitura,,Hagnos,1072,14x21 Cm,560g,Capa Dura + Borda Pintada,,2022,"R$ 56,90"
Bíblia Sagrada - NVI - Clássica c/ plano leitura,,Hagnos,1072,14x21 Cm,560g,Capa Dura + Borda Pintada,,2022,"R$ 56,90"
Nova Bíblia Viva - Libertação,,Hagnos,1056,14x21cm,560g,Brochura Flexível Com Borda Pintada,,,"R$ 45,90"
José - Príncipe do Egito,Hernandes Dias Lopes,Hagnos,240,14x21 Cm,280g,Brochura,,2022,"R$ 56,90"
Bíblia Palavra Orada e Aplicada – Oração de Ezequiel,,Hagnos,1696,14x21 Cm,850g,Capa Dura | Borda Pintada | Cantos Redondos,,2022,"R$ 129,90"
Bíblia Palavra Orada e Aplicada - Oração de Jeremias,,Hagnos,1696,14x21 Cm,850g,Capa Dura | Borda Pintada | Cantos Redondos,,2022,"R$ 129,90"
Bíblia Palavra Orada e Aplicada - Oração de Paulo,,Hagnos,1696,14x21 Cm,850g,Capa Dura | Borda Pintada | Cantos Redondos,,2022,"R$ 129,90"
Bíblia Palavra Orada e Aplicada - Oração de Ana,,Hagnos,1696,14x21 Cm,850g,Capa Dura | Borda Pintada | Cantos Redondos,,2022,"R$ 129,90"
Cantares para casais,David J. Merkh,Hagnos,240,16x23 Cm,380g,Brochura,,2022,"R$ 42,90"
O Apóstolo do Senhor Crucificado,Michael J. Gorman,Hagnos,864,16x23 Cm,1260g,Capa Dura Com Pintura Lateral,,2022,"R$ 169,90"
O Deus desconhecido,Hernandes Dias Lopes,Hagnos,128,14x21 Cm,300g,Brochura,,2023,"R$ 34,90"
